{
  "bundle_format": 3,
  "visual_assets": [],
  "form_fields": [
    {
      "name": "display_name",
      "value": "Avery Fixture",
      "locator": "input#display-name"
    },
    {
      "name": "contact_email",
      "value": "avery@example.com",
      "locator": "input#contact-email"
    },
    {
      "name": "account_password",
      "value": "[REDACTED PASSWORD]",
      "locator": "input#account-password"
    },
    {
      "name": "release_notes_opt_in",
      "value": "true",
      "locator": "body > main > form > fieldset > label:nth-of-type(1) > input"
    },
    {
      "name": "digest_frequency",
      "value": "true",
      "locator": "body > main > form > fieldset > label:nth-of-type(2) > input"
    },
    {
      "name": "digest_frequency",
      "value": "false",
      "locator": "body > main > form > fieldset > label:nth-of-type(3) > input"
    },
    {
      "name": "timezone",
      "value": "UTC+01:00 Berlin",
      "locator": "select#timezone"
    },
    {
      "name": "signature_note",
      "value": "Sent from the quarterly review workstation.",
      "locator": "textarea#signature-note"
    }
  ],
  "embedded_media": []
}
